sujet,date,statut
Synthwave et imagerie rétro-futuriste spatiale en décoration,2025-10-12T16:11:57.416634,succès_2025-10-13_09:00
Guardians of the Galaxy : quand les couleurs cosmiques deviennent pop,2025-10-12T16:19:41.226944,échec_publication
Culture rave et nébuleuses fluorescentes dans la déco moderne,2025-10-12T16:23:17.575092,échec_publication
Interstellar et la nouvelle représentation des trous noirs,2025-10-12T16:27:12.139896,succès_2025-10-13_09:00
Science-fiction française et son influence sur l'art spatial européen,2025-10-12T16:32:04.935086,succès_2025-10-13_09:00
Mouvement Outrun : l'obsession pour les horizons cosmiques,2025-10-12T16:41:30.372107,succès_2025-10-13_09:00
Steampunk spatial : l'astronomie rétro réinventée en décoration,2025-10-12T16:48:53.656826,succès_2025-10-13_09:00
Influence de Moebius sur l'esthétique désertique-spatiale,2025-10-12T16:53:15.460124,échec_publication
Cosmic Horror : de Lovecraft aux intérieurs gothiques spatiaux,2025-10-12T16:57:11.553343,échec_publication
Mythologies stellaires africaines dans l'art contemporain,2025-10-12T17:00:29.733276,échec_publication
Science-fiction française et son influence sur l'art spatial européen,2025-10-12T17:38:22.666723,succès
Mouvement Outrun : l'obsession pour les horizons cosmiques,2025-10-13T06:58:49.863457,succès
Steampunk spatial : l'astronomie rétro réinventée en décoration,2025-10-13T07:04:34.644217,succès
Influence de Moebius sur l'esthétique désertique-spatiale,2025-10-13T07:09:10.602359,succès
Comment choisir une palette de couleurs neutres pour un Airbnb ?,2025-10-13T07:48:48.775953,succès
Quelles sont les meilleures idées de décoration minimaliste pour location saisonnière ?,2025-10-13T07:53:18.247636,succès
Quels tons chauds apportent de la convivialité dans un couloir froid ?,2025-10-18T14:02:04.491839,succès
Comment mesurer l'espace minimal entre un tableau et une porte qui s'ouvre dans un couloir ?,2025-10-20T21:02:32.709016,succès
Quel type de verre acrylique incassable pour un tableau dans un couloir de copropriété ?,2025-10-23T21:02:57.965723,succès
Tableau avec palette limitée ou multicolore : quel choix pour un couloir neutre ?,2025-10-27T21:02:30.120029,succès
Quelles dimensions pour un tableau au-dessus d'une console dans un couloir d'entrée ?,2025-10-30T21:02:57.496928,succès
Comment éviter qu'un tableau trop imposant écrase visuellement un couloir étroit ?,2025-11-03T21:04:08.656785,succès
Quel format de série de 5 tableaux identiques (5x20x30cm) pour un couloir galerie ?,2025-11-06T21:03:01.546500,succès
Tableau avec composition horizontale : comment élargir visuellement un couloir étroit ?,2025-11-10T21:02:36.600743,succès
Quels pigments résistants à la lumière artificielle permanente dans un couloir sans fenêtre ?,2025-11-13T21:03:15.075146,succès
